"License Number","License Type","Name of Program","AddressLine1","AddressLine2","AddressLine3","City","State","Zip","County","Phone","License Status","License Holder","Capacity","Type Of License","Restrictions","Services","Licensing Authority","Initial Effective Date","Current Effective Date","Expiration Date","License Holder Lives Onsite","EmailAddress",
"1118918","Family Child Care","Abdullahi Rabia Mohammed dba Spring Daycare LLC","651 NICOLLET MALL STE 135","","","Minneapolis","MN","55402-1640","Hennepin","(612) 226-2193","Active","Rabia Mohammed Abdullahi","14 ","Commercial Space","This program operates under the registered LLC name Spring Daycare LLC","Family Child Care","Hennepin County Human Services & Public Health Dept","12/18/2023","01/01/2026","12/31/2026","No ","",
"1099244","Child Care Center","Gardner School of Minneapolis","811 Lasalle Ave Ste 150","","","Minneapolis","MN","55402-2550","Hennepin","","Active","TGS Minneapolis, LLC","160","Ages Served: Infants Toddlers Preschool","None","Services: Day Program","Minnesota Department of Human Services","06/24/2019","01/01/2026","12/31/2026","   ","",
"1110618","Home and Community Based Services","HopeBerrey LLC","225 S 6TH ST STE 3900","","","Minneapolis","MN","55402-4622","Hennepin","(612) 886-6480","Temp Immediate Suspension: Under Appeal as of 09/29/2025","HopeBerrey LLC","   ","Basic Support Services: 24-hour emergency assistance; Adult companion services; Homemaker; Night supervision; Respite care, in home or out-of-home; Individual community living support; Individualized home supports  In-Home Support Services: Individualized home supports with training  Employment Services: Employment exploration services; Employment support services    ","None","","Minnesota Department of Human Services","04/15/2022","01/01/2025","12/31/2025","   ","",
"1010579","Child Care Center","Kinderberry Hill Child Development Center","50 S 6th St Ste 260","","","Minneapolis","MN","55402-5137","Hennepin","(612) 436-1003","Active","KHCDII, Inc.","98 ","Ages Served: Infants Toddlers Preschool","None","Services: Day Program","Minnesota Department of Human Services","09/05/2001","01/01/2026","12/31/2026","   ","",
"1114399","Home and Community Based Services","Paradise Home Healthcare LLC","30 S 9TH ST STE 230","","","Minneapolis","MN","55402-3106","Hennepin","(612) 910-8649","Active","Paradise Home Healthcare LLC","   ","Basic Support Services: 24-hour emergency assistance; Adult companion services; Homemaker; Night supervision; Respite care, in home or out-of-home; Individual community living support; Individualized home supports  In-Home Support Services: Individualized home supports; Individualized home supports with training; Individualized home supports with family training    ","None","","Minnesota Department of Human Services","09/13/2024","01/01/2026","12/31/2026","   ","",
